{
  "digest": "9f86d081884c7d659a2feaa0c55ad015a3bf4f1b2b0b822cd15d6c15b0f00a08",
  "published_at": "2026-10-01T14:03:11Z",
  "run_url": "https://github.com/stillwater-brook/stillwater-brook-records/actions/runs/1234567890",
  "commit": "c4c623d",
  "records": {
    "added": ["2026-09-16-board-minutes"],
    "changed": [],
    "retracted": []
  },
  "standing": {
    "green": 4,
    "amber": 1,
    "red": 0,
    "no_data": 2
  }
}
